{
  "$schema": "../schemas/harness-config.schema.json",
  "schemaVersion": 1,
  "ado": {
    "organization": "<ADO_ORGANIZATION>",
    "project": "<ADO_PROJECT>",
    "releaseQueryId": "<ADO_SAVED_QUERY_ID>",
    "allowedHttpsOrigins": [
      "https://dev.azure.com/<ADO_ORGANIZATION>"
    ]
  },
  "salesforce": {
    "orgs": [
      {
        "alias": "<DEV_ALIAS>",
        "environment": "dev",
        "expectedInstanceHost": "<MY_DOMAIN>--<DEV_SANDBOX>.sandbox.my.salesforce.com",
        "expectedOrganizationId": "<DEV_ORGANIZATION_ID>"
      },
      {
        "alias": "<STAGE_ALIAS>",
        "environment": "stage",
        "expectedInstanceHost": "<MY_DOMAIN>--<STAGE_SANDBOX>.sandbox.my.salesforce.com",
        "expectedOrganizationId": "<STAGE_ORGANIZATION_ID>"
      },
      {
        "alias": "<UAT_ALIAS>",
        "environment": "uat",
        "expectedInstanceHost": "<MY_DOMAIN>--<UAT_SANDBOX>.sandbox.my.salesforce.com",
        "expectedOrganizationId": "<UAT_ORGANIZATION_ID>"
      }
    ],
    "review": {
      "enabled": false,
      "deniedOrganizationIds": [],
      "apiVersion": "67.0",
      "allowedPackageNamespaces": [],
      "allowedObjectApiNames": [],
      "maxFieldsPerObject": 500,
      "evidenceMaxAgeMinutes": 30
    }
  },
  "safety": {
    "allowScopedEnumeration": false
  },
  "workspace": {
    "salesforceRootName": "brain-core",
    "manifestPath": "manifest/package.xml"
  },
  "cache": {
    "wikiPageMaxAgeMinutes": 129600,
    "onStaleDefault": "ask"
  },
  "knowledge": {
    "chatReviewer": "<FULL_NAME_OF_THE_HUMAN_WHO_APPROVES_KNOWLEDGE_IN_CHAT>"
  }
}
